<?xml version="1.0"?>
<?xml-stylesheet href="style.css" type="text/css"?>
<!DOCTYPE basededonnees SYSTEM "basededonnees.dtd">
<basededonnees>
	<listeFilm>
		<FILM idFilm="FFG3" titre="Forrest Gump" description="..." realisateur="..." duree="...">
			<GENREREF id="GANIM"> </GENREREF>

			<descriptionx date="19/03/2021"> 
				DESCRIPTION
			</descriptionx>
		</FILM>

		<FILM idFilm="FFRT" titre="FRT" description="..." realisateur="..." duree="...">
			<GENREREF id="Horreur"> </GENREREF>
			<descriptionx auteur="gtesd"> 
				<url>Lien</url>
				</descriptionx>	
		</FILM>
		
		<FILM idFilm="FDSF" titre="DSF" description="..." realisateur="..." duree="...">
			<GENREREF id="ComÃ©die"> </GENREREF>	
		</FILM>

	</listeFilm>
</basededonnees>